{
  "id": "MEANING",
  "relation": "TRUTH",
  "territory": "TRUTH_LANGUAGE_SCIENCE",
  "label": {
    "fr": "Le sens des mots",
    "en": "The meaning of words"
  },
  "question": {
    "fr": "D'où les mots tiennent-ils leur sens ?",
    "en": "Where do words get their meaning?"
  },
  "stakes": {
    "fr": "Selon que le sens vient de la chose nommée, de l'usage partagé ou de l'intention de qui parle, se méprendre n'a pas la même origine, et traduire d'une langue à l'autre devient possible ou désespéré. Se positionner, c'est dire ce qui, au fond, nous permet de nous comprendre, et pourquoi parfois nous n'y parvenons pas.",
    "en": "Depending on whether meaning comes from the thing named, from shared usage, or from the speaker's intention, a misunderstanding has a different source, and translating from one language to another becomes possible or hopeless. To take a position is to say what, at bottom, lets us understand one another, and why we sometimes fail to."
  },
  "layer": "THEORY",
  "type": "TRIANGULAR",
  "poles": [
    {
      "id": "REFERENTIALISM",
      "label": {
        "fr": "Référentialisme",
        "en": "Referentialism"
      },
      "description": {
        "fr": "Le sens d'un mot, c'est ce à quoi il renvoie dans le monde : un nom désigne un objet, une phrase décrit un état de choses. Comprendre, c'est savoir de quoi l'on parle.",
        "en": "A word's meaning is what it refers to in the world: a name designates an object, a sentence describes a state of affairs. To understand is to know what one is talking about."
      },
      "figures": [
        {
          "slug": "russell",
          "name": { "fr": "Russell", "en": "Russell" }
        }
      ],
      "nuances": [
        {
          "fr": "Russell en est un emblème imparfait : sa théorie des descriptions corrige déjà le référentialisme naïf, par exemple pour les noms qui ne désignent rien.",
          "en": "Russell is an imperfect emblem: his theory of descriptions already corrects naive referentialism, for instance for names that designate nothing."
        }
      ]
    },
    {
      "id": "USE_THEORY",
      "label": {
        "fr": "Théorie de l'usage",
        "en": "Use theory"
      },
      "description": {
        "fr": "Le sens d'un mot n'est pas une chose qu'il représente, mais son emploi : la signification, c'est l'usage. On apprend ce que veut dire un mot en voyant comment on s'en sert dans <c id='jeu-de-langage'>les jeux de langage</c> de la vie commune.",
        "en": "A word's meaning is not a thing it stands for but its employment: meaning is use. We learn what a word means by seeing how it is used in <c id='jeu-de-langage'>the language games</c> of shared life."
      },
      "figures": [
        {
          "slug": "wittgenstein",
          "name": { "fr": "Wittgenstein", "en": "Wittgenstein" }
        }
      ]
    },
    {
      "id": "SPEAKER_INTENTION",
      "label": {
        "fr": "Intention du locuteur",
        "en": "Speaker's intention"
      },
      "description": {
        "fr": "Le sens tient à ce que celui qui parle cherche à faire reconnaître : communiquer, c'est donner à autrui de quoi saisir notre intention. Le sens conventionnel des mots dérive de ces intentions partagées dans le temps.",
        "en": "Meaning lies in what the speaker seeks to get recognised: to communicate is to give another the means to grasp our intention. The conventional meaning of words derives from such intentions shared over time."
      },
      "figures": [
        {
          "slug": "grice",
          "name": { "fr": "Grice", "en": "Grice" }
        }
      ],
      "nuances": [
        {
          "fr": "Grice vise d'abord le « vouloir-dire » du locuteur dans un énoncé ; le sens conventionnel des mots en est tenu pour dérivé.",
          "en": "Grice targets first the speaker's meaning in an utterance; the conventional meaning of words is taken to derive from it."
        }
      ]
    }
  ],
  "core": false,
  "difficulty": 3,
  "clusters": [],
  "relatedAxes": [
    "TRUTH_NATURE",
    "KNOWLEDGE_STATUS",
    "METAPHILOSOPHY"
  ]
}
